{
  "cwd": "workspace",
  "execution": {
    "cwd": "workspace",
    "environment_policy": {
      "codex_home": "role_runtime/codex-home",
      "home": "role_runtime/home",
      "keys": [
        "ALL_PROXY",
        "CODEX_CI",
        "CODEX_HOME",
        "HOME",
        "HTTPS_PROXY",
        "HTTP_PROXY",
        "LANG",
        "LC_ALL",
        "NO_PROXY",
        "PATH",
        "TERM",
        "TMPDIR"
      ],
      "tmpdir": "role_runtime/tmp"
    },
    "resolved_argv": [
      "/opt/homebrew/bin/codex",
      "exec",
      "--ignore-user-config",
      "--ignore-rules",
      "--skip-git-repo-check",
      "--disable",
      "memories",
      "--disable",
      "plugins",
      "--disable",
      "apps",
      "-m",
      "gpt-5.6-sol",
      "-c",
      "model_reasoning_effort=\"medium\"",
      "-c",
      "approval_policy=\"never\"",
      "-c",
      "sandbox_mode=\"danger-full-access\"",
      "--output-schema",
      "$ROLE_RUNTIME/output-schema-01.json",
      "--json",
      "-o",
      "$ROLE_RUNTIME/last-message-01.json",
      "-s",
      "danger-full-access",
      "-C",
      "$ROLE_WORKSPACE",
      "-"
    ],
    "sandbox_profile_sha256": "f07031f62b0422d4daf9b3729e81e815cb8f8e8773bcd81b8b66fee856b43427"
  },
  "forbidden_surfaces": [
    "arm identity or Memory",
    "spec quality or rubric",
    "other transcript"
  ],
  "formal_eligible": false,
  "input_envelope_sha256": "40ffbf5843cae6c35c4a407d65f1146b6e31a033e00db27b6cd30665de200253",
  "instructions_sha256": "812dc0ae5eb8f4b99e389b7aeaa690022d6930957e5d99bd732cf7912f2a1c01",
  "isolation": {
    "codex_home": "temporary_isolated",
    "filesystem_read": "macos_sandbox_exec_seatbelt",
    "home": "temporary_isolated",
    "ignore_user_config": true
  },
  "lifecycle": "ephemeral",
  "manifest_id": "burden-T1",
  "model": "gpt-5.6-sol",
  "output_schema_sha256": "e1e83a56c9a638687d008ca8f70bd905a448f842cef1e84c15b6a552a85c3ceb",
  "readable_roots": [
    "role_runtime_except_credentials",
    "system_runtime",
    "workspace"
  ],
  "reasoning_effort": "medium",
  "role": "burden_scorer",
  "schema_version": "1.0",
  "skill_closure": [],
  "tools": {
    "network": false,
    "shell": true,
    "workspace_write": false
  },
  "visible_files": [
    {
      "path": "AGENTS.md",
      "sha256": "812dc0ae5eb8f4b99e389b7aeaa690022d6930957e5d99bd732cf7912f2a1c01"
    },
    {
      "path": "transcript.json",
      "sha256": "848e4e2bbdfc9e1bc6203bf3a487fcb6e0166e57b864c78c9e94dc3ceff8b627"
    }
  ]
}
